分类,吸引点击的标题,评论量,URL,不会点击的标题,评论量,URL
,"百度做社交了？还捡起了几年前的""校内网""模式？",158,http://tech.163.com/17/0509/12/CK0BFPIA00097U7R.html,"共享充电宝行业太火，""Hi电""获近亿元A轮融资",148,http://tech.163.com/17/0509/10/CK03O82100097U7R.html
,机器人不仅会“读心术” 它还能画出来你在想什么,3,http://tech.163.com/17/0509/11/CK07GDG300098GJ5.html,金山软件宣布准备拆分办公软件到深交所上市,0,http://tech.163.com/17/0509/14/CK0HAKNL00097U7T.html
,易评机：谜一样的成都机场无人机“黑飞”事件,1178,http://digi.163.com/17/0509/00/CJV2RP6T001680OS.html,"""硅谷最精明投资人""大赞马斯克：当代“爱迪生”",12,http://tech.163.com/17/0509/09/CK037V9100097U7T.html
,中科院院士：去小行星采矿中国10年内就能做到,6130,http://tech.163.com/17/0509/07/CJVPMHPE00097U81.html,豪掷160亿美元，私募股权公司KKR拟收购东芝芯片部门,2,http://tech.163.com/17/0509/09/CJVVVKVS00097U7R.html
,刘强东：京东长期利润会超过任何一家线下企业,12538,http://tech.163.com/17/0509/07/CJVQ5UB300097U7R.html,易到拿到北京网约车许可证 但不意味着不用管控,347,http://tech.163.com/17/0509/08/CJVU83U700097U7R.html
,看看苹果面试提的44个奇葩问题，你能回答出几个,84,http://tech.163.com/17/0509/10/CK05H2SU00097U7T.html,百度游戏业务分拆出售 更名为多酷游戏,2,http://tech.163.com/17/0509/10/CK03GG0C00097U7R.html
,英国男子称iPhone7在接电话时爆炸：幸好手没残,103,http://tech.163.com/17/0509/09/CK03319A00097U7S.html,潘多拉第一季度营收3.16亿美元 净亏1.32亿美元,9,http://tech.163.com/17/0509/07/CJVQB5L300097U7R.html
,“理想主义企业家”贾跃亭能渡过此劫吗？,361,http://tech.163.com/17/0509/09/CK02VQ4H00097U7R.html,高通：支持QC4.0快充的智能手机将于年中到来,84,http://tech.163.com/17/0508/21/CJUMSAJL00097U7T.html
,“老虎”直播平台被打，“黄鳝门”女主播被抓,106,http://tech.163.com/17/0509/11/CK08U80M00097U82.html,深交所问了乐视网16个问题:是否存关联方资金占用,249,http://tech.163.com/17/0508/15/CJU5033R00097U7R.html
,微软布局人工智能，就押注在这两大杀器上了？,0,http://tech.163.com/17/0509/08/CJVVGH4S00098GJ5.html,联通董事长：正与十个部门沟通混改，希望改革后真正独立运营,34,http://tech.qq.com/a/20170509/020333.htm
,移居月球靠啥盖房？用月球土壤就可3D打印成砖块,2,http://tech.163.com/17/0509/10/CK047VOH00097U81.html,《纽约时报》数字业务收入在过去六年翻了一番,1,http://tech.qq.com/a/20170509/022843.htm
,为霾所困 韩国人不服:怪中国来的西风和本地烤鱼,487,http://tech.163.com/17/0509/07/CJVP9G4900097U81.html,第一季度美国科技行业发生486宗收购活动 同比增28%,0,http://tech.qq.com/a/20170509/006038.htm
,警惕！引诱青少年自杀的蓝鲸游戏已来到国内,41,http://tech.163.com/17/0509/10/CK04L2IP00097U7R.html,苹果在欧美增建数据中心 拟用服务接力硬件收入,1,http://tech.qq.com/a/20170509/016666.htm
,Unanimous A.I.准确预测法国总统，背后靠什么？,0,http://tech.163.com/17/0509/08/CJVVA96G00098GJ5.html,巴菲特的中国朝圣者：组团参会团费15万，王石站台比亚迪,12,http://tech.qq.com/a/20170509/017393.htm
,大数据画像：空巢青年钱不多但信用好,5,http://tech.163.com/17/0509/11/CK08HTO300097U7R.html,苹果大幅降低外部广告伙伴佣金分成 从7%降低到2.5%,5,http://tech.qq.com/a/20170509/006894.htm
,今后持银联卡在澳门ATM取钱要先“刷脸”,40,http://tech.163.com/17/0509/07/CJVR7GIA00097U82.html,华尔街调高苹果目标股价 市值将率先突破1万亿美元,154,http://tech.qq.com/a/20170508/057510.htm
,美女创业者一年半败光5000万?这事剧情反转再反转,3823,http://tech.163.com/17/0508/08/CJTA519300097U7R.html,亚马逊将统领美国智能音箱市场 今年有望独占70.6%份额,7,http://tech.qq.com/a/20170508/057923.htm
,人才难留?研发人员税负过重，月薪6万到手3万多,6355,http://tech.163.com/17/0508/09/CJTDKIOT00097U81.html,圆通曲线登陆港股 10亿港元收购先达国际物流控股权,7,http://tech.qq.com/a/20170509/005485.htm
,索尼与松下都开始做养老产业，顺便还能卖家电,0,http://tech.163.com/17/0509/09/CK03A85600097U7T.html,戴尔公开风投基金戴尔科技资本 年投资额约1亿美元,0,http://tech.qq.com/a/20170508/057889.htm
,不惧危险?调查显示40%的人希望拥有一辆飞行汽车,36,http://tech.163.com/17/0508/20/CJULFL2C00097U7T.html,东南亚电商Garena获5.5亿美元融资 更名为Sea,2,http://tech.qq.com/a/20170508/034995.htm
,Facebook在英国大选前打广告：“假新闻”有毒,82,http://tech.163.com/17/0508/18/CJUDGP0N00097U7R.html,圆通曲线登陆港股 10亿港元收购先达国际物流控股权,1,http://tech.sina.com.cn/i/2017-05-08/doc-ifyeychk7154825.shtml
,Facebook宕机 全球人民都吓坏了,30,http://tech.qq.com/a/20170509/021019.htm,亚马逊占据智能音箱7成市场 触屏Echo或使其优势更大,0,http://tech.sina.com.cn/it/2017-05-09/doc-ifyeycfp9381051.shtml
,共享充电宝要翻越三座大山,8,http://tech.qq.com/a/20170509/005024.htm,芝麻分600+重磅福利！再也不用买新手机了,505,http://www.toutiao.com/a6418086829269991682/
,途牛订好的酒店“不存在” 耽误行程每人仅获赔100元,28,http://tech.qq.com/a/20170509/006641.htm,HoloLens国行版终于来了，开发者版本售23488元,1985,http://tech.163.com/17/0510/09/CK2JFFIU00097U7T.html
,Facebook报纸上刊登整版广告 教人们识别假新闻,6,http://tech.qq.com/a/20170509/005025.htm,40天投入12亿元，共享充电宝的投资人们究竟图啥,42,http://tech.163.com/17/0510/14/CK3604QO00097U7R.html
,iPhone为何国内卖不动？外媒：微信太火,2162,http://tech.qq.com/a/20170508/031924.htm,与王思聪斗嘴背后，聚美投共享充电宝成败几何？,865,http://tech.163.com/17/0510/10/CK2OAFU200097U7R.html
,48条小米生态链战地法则：发动攻击就要像狼群一样,76,http://tech.qq.com/a/20170508/050004.htm,2017新财富500富人榜：贾跃亭财富同比缩水295亿,1372,http://tech.163.com/17/0510/07/CK2CR3FM00097U7R.html
,Spotify创始人写信给欧盟：指控苹果和谷歌滥用霸权,0,http://tech.qq.com/a/20170508/057825.htm,董明珠今年第二次增持格力电器:耗资95万买3万股,237,http://tech.163.com/17/0510/10/CK2P179100097U7R.html
,移动银行改变穷人生活 盖茨这七大疯狂预言都有可能现实,73,http://tech.qq.com/a/20170508/033719.htm#p=1,乐视网高管3亿增持计划将延期 并给出三个理由,1209,http://tech.163.com/17/0510/07/CK2E7N7900097U7R.html
,打车应用Uber将死于无人驾驶技术之手 来看看为什么,6,http://tech.qq.com/a/20170508/032463.htm,美专家团队：发现决定头发颜色的蛋白质,0,http://tech.163.com/17/0510/13/CK327O5M00097U81.html
,这根卖 200 多块的“大香蕉”，想让你把 iPhone 扔到一边 ,20,http://www.sohu.com/a/139242518_413981?loc=1&focus_pic=0,联通正与10家部委沟通混改 分析:动机是资金短缺,434,http://tech.163.com/17/0510/07/CK2DB7F500097U7S.html
,当人工智能学会“读唇术”，究竟意味着什么 ,1,http://www.sohu.com/a/139255249_130496,传软银下周将宣布旗下科技基金已注资950亿美元,31,http://tech.163.com/17/0510/07/CK2CE2LP00097U7R.html
,米6质量问题频发，小米还有希望重回巅峰吗？ ,0,http://www.sohu.com/a/139242793_116706?loc=1&focus_pic=0,法国环境部:除了授权海洋馆 禁止圈养海豚和鲸,1,http://tech.163.com/17/0510/14/CK36L6C000097U81.html
,你能为了保护地球做到什么地步？比如，以后改吃肉虫子？ ,2,http://www.sohu.com/a/139166631_119097,矛盾与压力：亚马逊推触摸屏Echo是变性之危？,2,http://tech.163.com/17/0510/08/CK2HP33000097U7R.html
,王思聪愿为它吃翔，马化腾却投资：共享充电宝已疯？,0,http://tech.sina.com.cn/zl/post/detail/i/2017-05-09/pid_8510834.htm,滴滴上月融资55亿美元 其中软银投入了20亿美元,177,http://tech.163.com/17/0510/07/CK2CLTNE00097U7R.html
,外卖副总裁离职了，百度O2O业务还能走多远？,0,http://tech.sina.com.cn/zl/post/detail/i/2017-05-09/pid_8510837.htm,LGD回应OLED项目落户传闻：目前没有这个想法,1,http://tech.163.com/17/0510/15/CK37CFCM00097U7T.html
,音悦Tai怎么了：曾融资千万美金，如今战略收缩资金吃紧,0,http://tech.sina.com.cn/zl/post/detail/i/2017-05-09/pid_8510825.htm,6000亿市场空间 2020年有150架C919批量生产能力,25,http://tech.163.com/17/0510/07/CK2C62LU00097U81.html
,Facebook假新闻又来干扰大选？这次是英国中招,2,http://tech.sina.com.cn/i/2017-05-09/doc-ifyeychk7166536.shtml,欧盟10亿欧元量子研究将会在今年接受项目申请,0,http://tech.163.com/17/0510/15/CK376TN600097U81.html
,支付宝在美国新进展：又有400万美国商户接受支付宝,31,http://tech.sina.com.cn/i/2017-05-09/doc-ifyeycfp9382638.shtml,多国政策松动推动上涨：比特币步入万元时代,4,http://tech.163.com/17/0510/16/CK3CF61900097U7R.html
,芝麻信用、腾讯征信……你们在无照裸奔呦,2,http://tech.sina.com.cn/zl/post/detail/i/2017-05-09/pid_8510840.htm,知识付费也有了盗版：价值上千元内容仅售20块！,313,http://tech.163.com/17/0511/07/CK50VVKI00097U7R.html
,王思聪又开始怼上了，陈欧大手笔狂甩30亿反击！,562,http://www.toutiao.com/a6416836738522218753/,英伟达花30亿美元打造这款AI芯片 售14.9万美元,320,http://tech.163.com/17/0511/08/CK53QMEC00097U7T.html
,原创｜王卫仍然拒绝见马云，两个大佬间到底有什么恩怨？,249,http://www.toutiao.com/a6410262163575111938/,中国联通继续停牌2个月：混改谈判还在过程中,152,http://tech.163.com/17/0511/08/CK539L2300097U7S.html
,未来十年，这20个预言将成为现实！你信吗？,204,http://www.toutiao.com/a6418002416263758338/,“追风者”：看在危险中寻求刺激的冒险者们,0,http://tech.163.com/photoview/0AI20009/14940.html#p=CK57CHAC0AI20009
,你的手机号可能曾经不是你的，你手机号的上一任主人是谁？,2515,http://www.toutiao.com/a6411260642866856194/,开发者福利，微软正式推出Mac版Visual Studio,479,http://tech.163.com/17/0511/07/CK4UMHEE00097U7T.html
,王思聪怼错了人，少年成名的陈欧可是富二代们的偶像！,123,http://www.toutiao.com/a6417682398238179586/,上市后首季度财报不如人意，Snap股价狂跌25%,2,http://tech.163.com/17/0511/07/CK4UTHDO00097U7R.html
,映客终于找到 “接盘侠”，但却离巨头位置越走越远,3,http://www.toutiao.com/a6418275705121014017/,2017GPU技术大会英伟达:千人数年30亿美元打造全新计算卡 ,12,http://dy.163.com/v2/article/detail/CK4U0T4F05119734.html
,刘强东被问：你的父母为啥不在京东买东西？刘强东的回答很机智！,392,http://www.toutiao.com/a6416664236667306242/,在黄仁勋进行AI演讲时，英伟达股价再次暴涨17%,9,http://tech.163.com/17/0511/08/CK53VEFG00097U7T.html
,看完小米雷军的抽烟姿势，再看看马云的，这姿势一个比一个销魂！,50,http://www.toutiao.com/a6418141908770046210/,特斯拉接受太阳能屋顶预定 6月份开始在加州安装,166,http://tech.163.com/17/0511/07/CK50NV7M00097U7T.html
,共享篮球来了，共享雨伞也来了，共享女友还远吗？,14,http://www.toutiao.com/a6418128983238951169/,曾经的反转基因活动家访华：中国反转观点已过时,116,http://tech.163.com/17/0511/08/CK548KLV00097U81.html
,豆瓣9.6，这部高分美剧绝对是理工男的最爱！,12,http://www.toutiao.com/a6418033109308899586/,美国对14家中企发起专利侵权调查 涉及可折叠插座,2,http://tech.163.com/17/0511/09/CK5714ER00097U82.html
,总跟马云在一起的大胡子是谁？都说他没落了，但没他可能就没马云,296,http://www.toutiao.com/a6414003967425265921/,痴迷博朗50年后，这位设计师决定把收藏全部捐出,2,http://tech.163.com/17/0511/08/CK53Q16N00097U7T.html
,王思聪你怎么看？共享雨伞也来了 网友高呼：想要共享女友,36,http://www.toutiao.com/a6418341547235115266/,配送机器人市场化临近: Loomo Go预计三季度量产,9,http://tech.163.com/17/0511/08/CK51FCP500097U7T.html
,有一种食堂叫阿里巴巴食堂：羡慕嫉妒恨啊,3770,http://www.toutiao.com/a6412714921074901249/#p=1,Echo配上触摸屏 亚马逊智能音响的路子可能偏了？,2,http://tech.163.com/17/0511/07/CK5052AO00097U7T.html
,这几款了不起的“黑科技”简直太科幻，分分钟让人感觉穿越到未来,51,http://www.toutiao.com/a6413178320910057730/#p=1,网易将发Q1股利 每股美国存托凭证1.08美元,11,http://tech.163.com/17/0511/07/CK4UD2MF00097U7R.html
,真的假的 马云让共享单车全部免押金？,11,http://www.toutiao.com/a6418322016880853250/,苹果设在柏林的秘密办事处曝光 就在市中心御林广场边上,2,http://tech.qq.com/a/20170511/021205.htm
,男子为发泄扔5辆共享单车进河 被网上追逃抓获,26,http://tech.163.com/17/0510/15/CK371K3L00097U7R.html,雷诺-日产：自动驾驶崛起不会影响全球汽车需求量,3,http://tech.qq.com/a/20170511/022888.htm
,"纽约到北京仅2小时？这家""超级高铁""公司可信吗",2628,http://tech.163.com/17/0510/07/CK2EMKS300097U81.html,亚马逊机器人技术更优 遏制对手追踪网站重要信息,0,http://tech.qq.com/a/20170511/022017.htm
,失业时间表？2020年这些职业将逐渐被AI取代,0,http://tech.163.com/17/0510/10/CK2NJFBR00098GJ5.html,Snap第一季度净亏损22.09亿美元 盘后股价重挫24%,10,http://tech.qq.com/a/20170511/002786.htm
,聊天机器人实力还是不行 咋能提升它们的知识水平,3,http://tech.163.com/17/0510/10/CK2NEV5S00097U7T.html,谷歌收购虚拟现实游戏公司Owlchemy Labs,0,http://tech.qq.com/a/20170511/014529.htm
,利用淘宝漏洞敲诈网店 河北两嫌疑人最高获刑1年半,354,http://tech.163.com/17/0510/07/CK2DEUB600097U7R.html,IPO后首份季报出师未捷 Snap CEO身家蒸发10亿美元,3,http://tech.qq.com/a/20170511/002963.htm
,人工智能将走向何方？我这有几点不成熟的小建议！,102,http://tech.163.com/17/0510/07/CK2C38TI00098GJ5.html,亚马逊Echo Show刚刚推出就被指责涉嫌抄袭,1,http://tech.qq.com/a/20170511/006747.htm
,与BAT正面对抗 99%的人工智能企业会死,1,http://tech.163.com/17/0510/11/CK2RLFH700098GJ5.html,微软对飙语音识别 准确率94.1%完败给科大讯飞,9,http://digi.tech.qq.com/a/20170511/001078.htm
,ofo被曝内部腐败严重 回应：一旦查实绝不姑息,44,http://tech.163.com/17/0510/16/CK3BUUDO00097U7R.html,Spectacles眼镜销售数据很难看 第一季仅卖6万副,3,http://tech.qq.com/a/20170511/005442.htm
,盘点9个最热门的有关iPhone 8的传言,185,http://tech.163.com/photoview/0AI20009/14932.html#p=CK2KS8M80AI20009,软银上财年业绩暴增至125亿美元 主要靠套现阿里获利,13,http://tech.qq.com/a/20170511/004776.htm
,一分钟让你家的WiFi速度飞起来！,13,http://www.toutiao.com/a6402048461344915713/,外媒：小米正与银行洽商 为一笔10亿美元贷款融资,78,http://tech.qq.com/a/20170510/044866.htm
,支付火药味儿浓，苹果正面开撕支付宝、微信,192,http://www.toutiao.com/a6418366104670699778/,上汽通用提速新能源战略 别克品牌推出首款增程式混合动力车,96,http://tech.qq.com/a/20170510/032050.htm
,"对比阿里和万达食堂,再看华为食堂,华为员工明显更幸福",14,http://www.toutiao.com/a6412208224287588866/,Snapchat第一季用户增长不及预期 扩大用户数量遇阻,0,http://tech.qq.com/a/20170511/002890.htm
,百度网盘：6月起需实名认证，未认证将遭强退,77,http://tech.163.com/17/0511/10/CK595A2R00097U7R.html,揭秘特斯拉最新SUV Model Y 最早或2019年上市,185,http://tech.qq.com/a/20170510/017975.htm#p=1
,情色产业挂靠知识付费大潮变现？获利远超你想象,120,http://tech.163.com/17/0511/07/CK50B24V00097U7R.html,微软要把Win 10电脑变为亚马逊Echo的竞争对手,3,http://tech.qq.com/a/20170510/034951.htm
,饿了么擅提餐品价格赚差价:平台价比正价贵30%,715,http://tech.163.com/17/0511/09/CK560IDD00097U7R.html,数据中心业务助力英伟达一季度营收大增48.4%,2,http://tech.qq.com/a/20170510/034415.htm
,Build大会|微软用3个小时解释如何赶超亚马逊,1,http://tech.163.com/17/0511/09/CK56CA3200097U7T.html,传软银千亿美元基金募资接近完成 最快将于下周宣布,6,http://tech.qq.com/a/20170510/034250.htm
,人类只剩100年？地球迎来末日的N种方式,91,http://tech.163.com/17/0511/07/CK4UOMM900097U81.html,英特尔加速通向5G 首款调制解调器下半年出样品,8,http://tech.qq.com/a/20170510/033802.htm
,所有超市都在做电商，我们对比了市场前五的超市,1,http://tech.163.com/17/0511/09/CK55NV3800097U7R.html,新美大的长征路，正有更多人掉队 ,0,http://www.sohu.com/a/139706262_115929?loc=1&focus_pic=1
,想吃什么并不取决于大脑而是你的肠道微生物？,6,http://tech.163.com/17/0511/07/CK4UTLDC00097U81.html,搜狐科技在现场：围绕AI看英伟达老黄放了多少大招 ,0,http://www.sohu.com/a/139681568_115565?loc=1&focus_pic=0
,百度将全面实行实名制 用网盘、发贴、评论都得实名认证,82,http://tech.qq.com/a/20170511/020701.htm,老罗：下半年推YunOS锤子手机 系统开放给其他厂商 ,0,http://www.sohu.com/a/139720492_161062?loc=1&focus_pic=0
,传乐视体育裁员50%，或重归“体育媒体公司”,21,http://tech.qq.com/a/20170511/026239.htm,「地狱」里的逍遥子，撑起3000亿商业航母 ,0,http://www.sohu.com/a/139566029_116015?loc=1&focus_pic=0
,《王者荣耀》爆红后，手游创业迎来新机会,37,http://tech.qq.com/a/20170511/006238.htm,毫无悬念 iPhone依然是全世界最流行手机 ,0,http://www.sohu.com/a/139696086_122331?loc=1&focus_pic=0
,别再往百度网盘存那种片子了 下月就要开始实名制,7,http://tech.qq.com/a/20170510/049509.htm,不惧起诉！华为在美成功击退韩国企业专利诉讼围剿 ,7,http://www.sohu.com/a/139508870_123380?loc=1&focus_pic=0
,京东市值无限逼近百度，BAT要变天？,401,http://tech.qq.com/a/20170510/033323.htm,别傻傻等更新，锤子 T1 用户们，该换坚果 Pro 了 ,11,http://www.sohu.com/a/139522825_413981?loc=1&focus_pic=0
,《时代》发布最新“20大最具影响力科技人物” 看看都有谁,28,http://tech.qq.com/a/20170510/030679.htm,联发科风光不再，不幸跌出全球半导体前十 ,11,http://www.sohu.com/a/139699284_187675?loc=1&focus_pic=0
,微信送你这份红包别乱拿，小心以后贷不了款 ,0,http://www.sohu.com/a/139548151_413981?loc=1&focus_pic=0,风扇配上涡轮增压，让家的空气从此流动起来 ,0,http://www.sohu.com/a/139683099_115300?loc=1&focus_pic=0
,你愿意尝试「一周CP」吗？这种新型社交会是好的商业模式吗？ ,0,http://www.sohu.com/a/139581389_114778?loc=1&focus_pic=0,我创业这两年发生的事情 ,3,http://www.sohu.com/a/139719104_118786?loc=1&focus_pic=0
,四招让你吃灰的Kindle起死回生 ,13,http://www.sohu.com/a/139577826_323552?loc=1&focus_pic=0,25 岁的 Adobe Premiere 更加强大，并已经支持 Touch Bar 和 Surface Dial 了 ,1,http://www.sohu.com/a/139607005_413981?loc=1&focus_pic=0
,链家回应称App遭苹果下架因审核规则，规则是什么 ,34,http://www.sohu.com/a/139561622_114778?loc=1&focus_pic=0,小米6对比三星S8:隔着屏幕都能感受到的差距 ,328,http://www.sohu.com/a/139525681_122331?loc=1&focus_pic=0
,膜拜深圳山寨机，这两款牛B神机把“原版”秒成渣 ,2,http://www.sohu.com/a/139736070_622635?loc=1&focus_pic=0,罗永浩发坚果Pro的最大意义：让人更期待T3,1,http://www.sohu.com/a/139523246_115888?loc=1&focus_pic=0
,刚大赚一笔，刘强东转手就买了辆千万跑车送老婆 ,96,http://www.sohu.com/a/139500871_235941?loc=1&focus_pic=0,暴风TV发布智能电视X5 ECHO，分体免遥控3999元起 ,0,http://www.sohu.com/a/139503829_117781?loc=1&focus_pic=0
,KTV再无活路？在线K歌能否成为救世主 ,0,http://www.sohu.com/a/139716074_115503?loc=1&focus_pic=0,扫除“苹果头盔”商标障碍，苹果自有VR发布或将近,0,http://www.sohu.com/a/139723586_123380?loc=1&focus_pic=0
,北京公共免费WiFi，又一个面子工程？,1,http://www.sohu.com/a/139448811_116221?loc=1&focus_pic=0,传索尼135mm顶级人像镜将采用f/1.8或f/1.4大光圈,1,http://www.sohu.com/a/139574637_499322?loc=1&focus_pic=0
,“闲鱼”低俗评论难禁 “原味内裤”藏留言里交易,109,http://www.sohu.com/a/139567226_542950?loc=1&focus_pic=0,锤子确认与YunOS合作，老罗变了还是行业变了？ ,12,http://www.sohu.com/a/139459220_118005?loc=1&focus_pic=0
,为什么OPPO vivo销量那么好 却还是有那么多人吐槽,23,http://www.sohu.com/a/139495595_466942?loc=1&focus_pic=0,超高屏占比!OPPO再曝Find 9渲染图 ,16,http://www.sohu.com/a/139553210_122331?loc=1&focus_pic=0
,怎么做笔记效率高？丢开电脑，用手写！ ,1,http://www.sohu.com/a/139642946_119097?loc=1&focus_pic=0,齿轮减速机应该如何选型？ ,0,http://www.sohu.com/a/139735100_415336?loc=1&focus_pic=0
,一根头发就能拎起的电子设备，还能生物降解 | 创技术 ,0,http://www.sohu.com/a/139709124_337363?loc=1&focus_pic=0,苹果发出WWDC邀请函 6月6日相约圣何塞 ,0,http://www.sohu.com/a/139515929_115978?loc=1&focus_pic=0
,20大最具影响力科技人物，中国上榜者令人惊疑 ,0,http://www.sohu.com/a/139577467_127323?loc=1&focus_pic=0,国产之光 OPPO R9s第一季乃国产机全球销量第一 ,0,http://www.sohu.com/a/139741383_161062?loc=1&focus_pic=0
,家里九年义务教育英语磁带别丢，神器就要回归了！ ,0,http://www.sohu.com/a/139468746_355019?loc=1&focus_pic=0,如微软HoloLens的混合现实，或会逐步颠覆多个行业 ,0,http://www.sohu.com/a/139505866_115856?loc=1&focus_pic=0
娱乐,韩红和央视美女主持人结婚了？卓伟罕见这么回应,10,http://ent.163.com/17/0509/15/CK0MDONT00038FO9.html,贾静雯产后晒怀抱女儿照 母爱爆棚露会心微笑,170,http://ent.163.com/17/0413/22/CHUF2HAO00038FO9.html
,凭《人民的名义》 周梅森雄踞作家收入榜首,953,http://ent.163.com/17/0413/17/CHTTI5V500038FO9.html,徐佳莹传授疗伤情歌 助失恋网友走出低潮,28,http://ent.163.com/17/0413/17/CHTTS8I700038FO9.html
,男神木村拓哉也老了！双颊肉下垂法令纹明显,919,http://ent.163.com/17/0413/16/CHTSD3LM00038FO9.html,郑恺早起化妆拍戏工作超努力！ 喊话网友不要赖床,220,http://ent.163.com/17/0509/09/CK02NIJT00038FO9.html
,白百何出轨小鲜肉影响大 多档节目称不再敢请她,38060,http://ent.163.com/17/0413/16/CHTRRFSR00038FO9.html,黄晓明与小朋友合照嘟嘴亲亲 自嘲不想暴露年龄,85,http://ent.163.com/17/0508/18/CJUECB5N00038FO9.html
,著名音乐人劈腿嫩妹致怀孕 遭泄露半裸床照报复,3133,http://ent.163.com/17/0509/08/CJVSU3N800038FO9.html,薛之谦银发随风飞舞获迷妹紧紧围绕,298,http://ent.163.com/photoview/00AJ0003/630670.html#p=CJUSCOLV00AJ0003
,老戏骨也迷手游！王庆祥戒瘾打卡大家一起监督,48,http://ent.163.com/17/0508/22/CJURITOS00038FO9.html,钟嘉欣携爱女探班苏永康 女儿大眼呆萌可爱,237,http://ent.163.com/17/0508/08/CJTC5GLE00038FO9.html
,日女团为吸粉出新招 花6块钱就能与偶像又亲又抱,1,http://ent.163.com/17/0509/09/CK030OER00038FO9.html,蒋欣衬衫配阔腿裤现身机场,254,http://ent.163.com/photoview/00AJ0003/630598.html#p=CJT93DLG00AJ0003
,疯狂女粉丝为刘德华守身29年 如今欲整容嫁人,482,http://ent.163.com/17/0508/21/CJUPVOOO00038FO9.html,范冰冰拍戏至深夜才收工 新剧女王造型好霸气,1044,http://ent.qq.com/a/20170509/002318.htm
,"黄渤""偷拍""徐静蕾大腿 被发现后徐静蕾这么说",9907,http://ent.163.com/17/0503/01/CJFNKC0200038FO9.html,十年不拍电视剧的张柏芝要回归了！将牵手吴建豪,65,http://www.sohu.com/a/139230736_114941
,葛天被网友怼难怪被抛弃 怒回:少点阴暗多点阳光,12780,http://ent.163.com/17/0503/01/CJFNF71900038FO9.html,《花少3》赖雨濛上线 昔日小公主勇敢挑战自我,1,http://yule.sohu.com/20170509/n492309003.shtml
,琼瑶与继子女公开互撕 50年恩怨情仇被围观,13368,http://ent.163.com/17/0508/01/CJSIG1C000038FO9.html,田海蓉红装活力亮相品牌高定 香肩微露宛若少女,0,http://yule.sohu.com/20170509/n492336699.shtml
,健身遭男教练尾随偷拍 行径恶劣难忍BY2发文诉苦,290,http://ent.163.com/17/0508/08/CJTCILMT00038FO9.html,巩峥简约LOOK演绎别样魅力 大展儒雅暖男范儿,0,http://pic.yule.sohu.com/group-785133.shtml#0
,生财有道！明星从卓伟处买回的偷拍或超亿元,27845,http://ent.163.com/17/0504/11/CJJCKTDJ00038FO9.html,Frandé法兰黛乐团新专辑演唱会 展现丰富音乐性,0,http://yule.sohu.com/20170509/n492302968.shtml
,陈冠希上节目提到谢霆锋一脸不屑,10433,http://ent.163.com/17/0507/08/CJQPJIB400038FO9.html,梅婷拍戏之余忙“咏春” 致敬诗人余秀华,1,http://yule.sohu.com/20170508/n492185408.shtml
,蒋欣两个月铲肉三十斤 迅速减肥靠这两招,8638,http://ent.163.com/17/0507/05/CJQF1R5600038FO9.html,李念带小朋友下棋 画面温馨惹网友羡慕,0,http://yule.sohu.com/20170505/n491825827.shtml
