分类,吸引点击的标题,评论量,URL,不会点击的标题,评论量,URL
社会,已婚大妈网恋1年被骗60万 事后发现对方是女婿,22,http://news.sina.com.cn/s/wh/2017-05-09/doc-ifyexxhw2889086.shtml,重庆现最隐秘轨道站 周围荒草丛生(图),131,http://news.sina.com.cn/s/wh/2017-05-09/doc-ifyeychk7159959.shtml
,男子足浴店消费600元只带1元 跳窗逃单被挂窗外,492,http://news.sina.com.cn/s/wh/2017-05-09/doc-ifyeychk7156123.shtml,爱尔兰沙滩消失33年 怪潮来临后重现(图),2,http://news.sina.com.cn/o/2017-05-09/doc-ifyexxhw2878121.shtml
,男子吸毒后感觉自己是祁同伟 报警寻求保护被抓,10,http://news.sina.com.cn/w/2017-05-09/doc-ifyexxhw2842571.shtml,男子欲携带44只野生鹦鹉出境 被海关查获刑拘,15,http://news.sina.com.cn/s/wh/2017-05-09/doc-ifyexxhw2852165.shtml
,久别老同学藏祸心 初三女学生被强迫至北京卖淫,0,http://news.sina.com.cn/s/wh/2017-05-09/doc-ifyeycfp9392323.shtml,男子拐工友儿子卖至外地 警察追查20年将其抓获,39,http://news.sina.com.cn/c/2017-05-09/doc-ifyexxhw2848372.shtml
,大学生毕业照原版再现《人民的名义》场景,22,http://news.sina.com.cn/o/2017-05-08/doc-ifyexxhw2841137.shtml,警方21天破3起特大贩毒案 缴获海洛因28.4公斤,0,http://news.sina.com.cn/s/wh/2017-05-08/doc-ifyeychk7135578.shtml
,"女游客被男列车员""拍胸""叫醒 投诉被要求拿证据",736,http://news.sina.com.cn/s/wh/2017-05-08/doc-ifyeycte9131797.shtml,国家环保督查组福建遭村民堵路 1名闹事者被罚,48,http://news.sina.com.cn/s/wh/2017-05-08/doc-ifyeycfp9372076.shtml
,俄罗斯死亡游戏潜入中国 网友称有人组织游戏群,2806,http://news.sina.com.cn/s/wh/2017-05-08/doc-ifyeychk7122119.shtml,17岁女儿非亲生 男子状告前妻获赔22万,253,http://news.sina.com.cn/s/2017-05-08/doc-ifyeycte9075019.shtml
,朝阳群众又立功 《毒战》制作人吸毒被抓,2,http://news.sina.com.cn/s/wh/2017-05-08/doc-ifyeycte9060827.shtml,男子为让自家核桃树长好 砍伐剥皮国有林区林木,12,http://news.sina.com.cn/s/wh/2017-05-08/doc-ifyeychk7114166.shtml
,美女创业者被指狂买LV烧5千万 给干妈开5万月薪,143,http://news.sina.com.cn/s/wh/2017-05-08/doc-ifyeycfp9339781.shtml,71岁留守老太家半夜着火 2位邻居冲进火海救人,0,http://news.sina.com.cn/s/wh/2017-05-08/doc-ifyeycfp9331683.shtml
,飞行员让实习生开载305人客机 自己睡觉被停职,205,http://news.sina.com.cn/o/2017-05-08/doc-ifyexxhw2719316.shtml,交警砸豪车救人遭误读 抱娃女子非妈妈是报警人,195,http://news.sina.com.cn/s/wh/2017-05-07/doc-ifyeycte9022447.shtml
,老太失足卡地铁站台间隙 众人齐推百吨地铁施救,61,http://news.sina.com.cn/s/wh/2017-05-08/doc-ifyeycte9039082.shtml,总经理不给自己签劳动合同 离职后要求公司赔偿,54,http://news.sina.com.cn/s/2017-05-07/doc-ifyeycte8959768.shtml
,高校班级拍反串毕业照 唯一男生穿婚纱,1644,http://news.sina.com.cn/s/2017-05-08/doc-ifyeycte9035664.shtml,"北京进行景观布置 迎""一带一路""高峰论坛",241,http://news.163.com/photoview/00AP0001/2254253.html#p=CK01RR3P00AP0001
,女子穿高跟追公交被轧身亡？尸检证实穿平底鞋,113,http://news.sina.com.cn/s/wh/2017-05-08/doc-ifyexxhw2701287.shtml,"清华副校长获百万大奖 称要给学生""改善生活""",0,http://news.163.com/17/0509/11/CK071C2M0001875P.html
,女子常年生病家中猝死 4岁儿伴尸2天3宿,6639,http://news.sina.com.cn/s/wh/2017-05-07/doc-ifyeychk7109995.shtml,上海老一辈空姐忆往事：厕所吐完继续服务乘客,0,http://news.163.com/17/0509/10/CK04ORPN000187VG.html
,公交站牌2.6米高 网友:姚明也未必能看清,264,http://news.sina.com.cn/c/2017-05-08/doc-ifyexxhw2694791.shtml,美国一名2岁“主厨”因制作美食成网红,62,http://society.qq.com/a/20170507/008793.htm
,完胜老干妈？这款中国辣酱在美国炒到10万天价,1721,http://news.sina.com.cn/zx/2017-05-07/doc-ifyeychk7103882.shtml,“巨贪村官”18年私吞1.5亿 被抓后村民放炮庆祝,7120,http://society.qq.com/a/20170508/004346.htm
,90后女子微信卖假药一夜暴富 只用一年买房买车,65899,http://news.163.com/17/0508/02/CJSO24UJ00018AOP.html,渔民捕获122斤黄唇鱼 卖347万天价,14928,http://society.qq.com/a/20170508/006864.htm
,为方便管理 幼儿园老师让孩子自打嘴巴,158,http://news.163.com/photoview/00AP0001/2254239.html#p=CJVV3UJ600AP0001,村主任盯上惠农资金：截留脱贫款 助骗救灾钱,0,http://news.sohu.com/20170509/n492298262.shtml
,离奇死亡！重庆一居民屋内发现2女1男3具尸体,3265,http://news.163.com/17/0509/09/CK02J4KS0001875P.html,无票游客青城山景区闯关打人 事后送来检讨书致歉,0,http://news.sohu.com/20170509/n492291086.shtml
,壮硕男子当街暴打猛踢女服务员 多人围观却不制止,13965,http://news.163.com/17/0509/09/CK00NCKG0001875P.html,藏獒连伤5人咬断主人手指 特警将其捕杀,3,http://news.sohu.com/20170509/n492275946.shtml
,新生儿手握避孕环出生：”想搞死老子没那么容易”,6,http://news.163.com/17/0509/10/CK069NKS0001875P.html,清华大学教授颜宁受聘普林斯顿大学,0,http://news.sohu.com/20170509/n492274026.shtml
,不寒而栗！美国纽约州惊现“幽灵”女孩,2129,http://society.qq.com/a/20170507/007657.htm,香港小孩备战幼升小:有人同时上六个兴趣班,0,http://news.163.com/17/0509/13/CK0E3UE00001875P.html
,女子在电梯里上厕所 监控拍下全过程,2435,http://henan.qq.com/a/20170506/032237.htm#p=2,广州传媒控股公司原副总徐卫涉嫌贪污等三罪被诉,1,http://news.163.com/17/0509/11/CK090BM90001875P.html
,2岁女童10楼坠亡 事发时正和爸妈看房,674,http://society.qq.com/a/20170508/002200.htm,幼儿园校车核载15人实载39人 园长驾驶员被刑拘,1,http://news.163.com/17/0509/12/CK0AE37400018AOQ.html
,大叔为少喝2碗酒连吞2支笔 36年后取出笔芯完好,317,http://society.qq.com/a/20170508/008089.htm,济南一小区三处违建强拆2年未果 部门回复:月底拆,2,http://news.163.com/17/0509/12/CK0CVOO800018AOP.html
,探秘全球首架787梦想商务机：收费50万/小时,222,http://society.qq.com/a/20170508/030149.htm,"孕妇送医途中死亡 家属""讨说法""暴力抗法2人被拘",45,http://news.163.com/17/0509/12/CK0DEF7P0001875P.html
,中国网络文学走红海外 美外交官也是粉丝,0,http://news.qq.com/a/20170509/001594.htm,南京一开发商没证就开卖交钱可选房 房管部门回应,964,http://news.163.com/17/0509/10/CK04HH8K000187VE.html
,这是我见过上地铁排得最整齐的队(图),6,http://news.sohu.com/20170509/n492289405.shtml,三人一心想发财结伙盗掘汉代古墓 第二次返回被抓,2,http://news.163.com/17/0509/09/CK012TR6000187VF.html
,古稀老太报警：遭黑客病毒攻击 眼睛视力下降,205,http://news.sohu.com/20170509/n492276690.shtml,房产户籍地址“打架” 居民疲于开证明,14,http://news.163.com/17/0509/06/CJVNI60G00018AOP.html
,年薪这个数就是“新锐中产”？可95%的人仍焦虑,1026,http://news.sohu.com/20170509/n492281487.shtml,广东自2015年以来共追回290名外逃人员,0,http://news.163.com/17/0509/00/CJV41OFF00018AOP.html
,西安试点新风进校园 就算雾霾天也可以放心呼吸,3,http://news.sohu.com/20170509/n492275908.shtml,大巴撞上2.5米限高杆受损严重 肇事后驶离现场,1,http://news.163.com/17/0509/00/CJV16ADF00018AOP.html
,初中女生画6米长另类毕业照 同学都变成小动物,229,http://news.sohu.com/20170509/n492275434.shtml,两男子网淘象牙制品出售牟利 均获刑半年,0,http://news.163.com/17/0509/13/CK0FG4BR00018AOQ.html
,“不听话就把你交给派出所”？妈妈真这么干了,309,http://news.sohu.com/20170509/n492275717.shtml,济南百米马路洒了一层柴油 过路人打滑摔倒,0,http://news.163.com/17/0509/13/CK0FRQTR00018AOP.html
,女子“怀孕”17年 腹中取出东西都有头发和牙了,2,http://news.sohu.com/20170509/n492268436.shtml,安徽省广播电视台一科长涉嫌巨额受贿被立案侦查,0,http://news.163.com/17/0509/13/CK0GABD80001875P.html
,小偷蹭婚宴欲下手不料全是警察 网友:刺不刺激,4,http://news.163.com/17/0509/10/CK05KNGJ0001875P.html,婴儿被遗弃在建筑工地 警方给弃婴父母时间未立案,1,http://news.163.com/17/0509/13/CK0E98LI00018AOP.html
,"男子街头""卖妻救女"" 妻子身穿婚纱为娃求救命钱",49219,http://news.163.com/17/0509/11/CK092SL00001875P.html,"卖鹦鹉被判刑 也拦不住鹦鹉交易市场""欣欣向荣""",440,http://news.sina.com.cn/s/wh/2017-05-10/doc-ifyeycfp9417923.shtml
,"直播平台涉嫌传播淫秽信息 ""黄鳝门""女主播被抓",10192,http://news.163.com/17/0509/11/CK07QA1F0001875N.html,“候鸟妈妈”回家了！ “女儿在哪儿，我就在哪儿”,1,http://news.sina.com.cn/s/2017-05-10/doc-ifyeycte9335259.shtml?cre=societypc&mod=inf&loc=1&r=0&doct=0&rfunc=76&tj=none&s=0
,传销培训课程曝光:带强烈性暗示 女学员穿比基尼,6265,http://news.163.com/17/0509/11/CK09TU990001875P.html,男子在四川绵阳机场净空区放飞无人机 被拘5天,307,http://news.sina.com.cn/o/2017-05-09/doc-ifyeycte9273803.shtml
,悬疑！女子报警称酒醉被抢 监控却显示犯人不存在,1278,http://news.163.com/17/0509/07/CJVRJAQN0001875P.html,甘肃一小学禁止学生早到校：为防老师家长监督空档,0,http://news.sohu.com/20170510/n492419393.shtml
,妻子在丈夫出轨后与领导缠绵 促成丈夫与领导换妻,1976,http://news.163.com/17/0509/00/CJV16B4100018AOP.html,云南省第一监狱越狱犯张林苍落网(图),3,http://news.sohu.com/20170510/n492417872.shtml
,奸杀11人白银案嫌犯:杀完8岁女孩很渴 喝了整杯水,53827,http://news.163.com/17/0508/22/CJUSCL460001875P.html,丽江市古城区查获100多件珍贵濒危野生动物制品,0,http://news.163.com/17/0510/10/CK2LRBUF000187VG.html
,女学员投诉驾校男教练:手不是摸大腿就是握手上,21484,http://news.163.com/17/0508/21/CJUNSUSI0001875P.html,"民生银行再现亿元""飞单案"" 投资人追讨资金3年无果",5,http://news.163.com/17/0510/10/CK2NQOAA0001875P.html
,爆笑来袭！史上最“拙劣”嫌犯画像也能破案？,48,http://news.163.com/17/0508/20/CJUK5VN70001875P.html,福建警方查获非法制造枪支案件 一男子被捕,0,http://news.163.com/17/0510/10/CK2MUT6M00018AOQ.html
,"70岁老人开""过期食品""超市 引得米其林主厨加入",19,http://news.163.com/17/0509/13/CK0F6FC20001875P.html,房产“蒸发”17平方米 卖家要赔205万,2905,http://www.toutiao.com/a6418197675690705153/
,小伙把自己关冰柜闻汽油味 遗体腐烂才被发现,5,http://news.sina.com.cn/s/wh/2017-05-10/doc-ifyeychk7206900.shtml,"台""立法院""旁现枪击案 男子疑遭枪击意识不清送医",1,http://war.163.com/17/0510/08/CK2HOQG8000181KN.html
,小学副校长涉性侵未成年女生被抓 受害人已怀孕,8,http://news.sina.com.cn/o/2017-05-10/doc-ifyexxhw3009245.shtml,感动！医生为舒缓产妇紧张情绪 紧握其手给其力量,246,http://news.163.com/17/0510/08/CK2FVNNA00014AEE.html
,月收入轻松过万？外卖小哥:全月无休才挣7千,9,http://news.sina.com.cn/c/2017-05-10/doc-ifyeycte9341013.shtml,50年前贫困夫妻忍痛送女 半世纪后失散家人重聚,512,http://news.163.com/17/0510/08/CK2FSE0S000187VI.html
,"昆明一陵园频频接""午夜凶铃"" 接通后对方不说话",141,http://news.sina.com.cn/s/wh/2017-05-10/doc-ifyeycte9319268.shtml,员工卖不出粽子就要扣工资？ 酒店称误会一场,40,http://news.163.com/17/0510/07/CK2C0KFR00018AOP.html
,英国学校用尸血治疗血友病儿童 72人染艾滋死亡,64,http://news.sina.com.cn/s/wh/2017-05-09/doc-ifyeychk7197707.shtml,四川野生杜鹃遭破坏 涉事男子被行政处罚,8,http://news.163.com/17/0510/02/CK1SQJ1P000187VI.html
,山东女子直播割腕自杀 网警赶到时轻生女已昏迷,0,http://news.sohu.com/20170510/n492419293.shtml,拆掉五层楼高的广告牌，千佛山终于“露脸”了！,0,http://ql1d.com/newsjin/show/source/rss/type/1/id/4276662.html?tt_group_id=6418260513382482178
,杀害广外女生嫌犯被公诉 称“砍人进监牢有饭吃”,0,http://news.sohu.com/20170510/n492416435.shtml,云南在押逃犯张林苍被抓 目击者称抓捕现场“火光冲天”,1,http://www.toutiao.com/a6418326088049312001/
,小和尚把地雷当球踢 玩了几天突然爆炸,446,http://society.qq.com/a/20170510/006523.htm#p=1,最新子女抚养费标准2017,9,http://www.toutiao.com/a6378242372471537922/
,套路深！渣男扮记者约美女 让女方付房费,1128,http://cd.qq.com/a/20170510/005689.htm,军人探亲路费标准公布，请参照执行！,77,http://www.toutiao.com/a6418296876698075393/
,蓝鲸自杀游戏玩家多为学生 共青团:启动捕鲸计划,773,http://news.163.com/17/0510/10/CK2MN9P90001875P.html,“离婚吧！凭什么你尽孝可以光明正大，我就得偷偷摸摸”,557,http://www.toutiao.com/a6414398846322868738/
,"少女遭恐怖分子劫持拒绝""释放"":很快乐不想离开",0,http://news.163.com/17/0510/10/CK2O2O9O0001875P.html,京GNU577，你以罚款5200、记18分并处拘留荣登榜首！,94,http://www.toutiao.com/a6418136806260277506/
,辣眼睛！排气扇太小 笨贼脱光衣服全裸进店盗窃,5,http://news.163.com/17/0510/10/CK2M6GFT0001875P.html,俄罗斯土豪两艘价值50多亿游艇同时现身,52,http://society.qq.com/a/20170510/022715.htm#p=1
,碰瓷者在女司机车前躺下，女司机一脚油门，车子就过去了！,411,http://www.toutiao.com/a6417956358629163266/,云南被捕越狱犯父亲:家里都好 莫牵挂好好改造,11,http://news.163.com/17/0510/13/CK32PIDF0001875P.html
,山西太原迎泽公园游乐设施臂杆断裂 4人被困半空,20,http://news.163.com/17/0510/08/CK2GS74100018AOQ.html,广西失踪男子晕倒湖南常德 医院开通绿色通道救治,1,http://news.163.com/17/0510/12/CK2T8FBC000187VG.html
,厂家揭秘抓娃娃机曝抓娃娃技巧 原来黑幕这么大,239,http://news.163.com/17/0510/08/CK2G3C0D0001875P.html,嚣张！男子骑无牌车遇检查 一脚踹倒警察扬长而去,8280,http://news.163.com/17/0510/13/CK31H5U50001875P.html
,他是家喻户晓的童星，昔日红极一时，如今竟靠垃圾桶掏食为生？,376,http://www.toutiao.com/a6417954179482861825/,济南外卖小哥走机动车道被查 反呛交警多管闲事,88,http://news.163.com/17/0510/12/CK2VBME700018AOP.html
,“男女同学聚会，最忌讳做的四件事”,27,http://www.toutiao.com/a6417943791987065089/,少年离家出走不慎落水 警民合力搜寻将其救起,0,http://news.163.com/17/0510/13/CK313SHS000187VG.html
,端午节就要到了，你的社保也迎来三大变化！,440,http://www.toutiao.com/a6417944514045444353/,为救助流浪狗，从一个千万富翁变成了一个需要社会上人员资助,12,http://www.toutiao.com/a6418151030677553409/
,高楼起火，到底往上跑还是往下跑？读完这篇你可能就懂了,837,http://www.toutiao.com/a6402054108979937538/,1983：牛玉强——“中国最后一个流氓”,33,http://www.toutiao.com/a6418167692066488577/
,用我的经历告诉你，为什么不要随便告诉别人工资！,654,http://www.toutiao.com/a6416589792888226050/,成都红星路化了个妆 戴上这些“花环”妖艳多了 ,4,http://www.toutiao.com/a6418165958092194049/#p=1
,画中画，听说是右脑发达的人才能看见 ,9562,http://www.toutiao.com/a6415470339027288322/#p=1,这个地方曾经人山人海，如今又为什么荒无人烟 ,177,http://www.toutiao.com/a6416232077822247169/#p=1
,我的家是车祸现场!一农家院门前1年发生48起车祸,430,http://news.163.com/17/0510/07/CK2EGD3U0001875P.html,您有一条超速94%的交通违法信息请速查收,171,http://www.toutiao.com/a6418046015060590850/
,男子深夜打车却不乘 骗的哥代运整箱大麻,257,http://news.163.com/17/0510/06/CK2BCVA2000187VI.html,逃犯张林苍被抓细节:武警鸣枪警告无效后击伤其腿,431,http://news.163.com/17/0510/13/CK32BVCC00018AOR.html
,海南一小学副校长涉嫌性侵未成年女生被抓,34,http://news.163.com/17/0510/05/CK25NFPJ00018AOP.html,图片故事：回不去老厂回不去时间 探访重庆山里的“军工”,82,http://www.toutiao.com/a6418286952593178881/#p=1
,"多社交平台查删""蓝鲸游戏""群组 女生入群要交裸照",26714,http://news.163.com/17/0510/02/CK1SQJ37000187VI.html,"海洋公园回应海豚带伤表演:系发情期""撕咬""所致",0,http://news.163.com/17/0510/15/CK38HOJB00018AOR.html
,泰国女同和变性人结婚 准备生孩子,39,http://news.163.com/photoview/00AP0001/2254455.html#p=CK2IFG1F00AP0001,广州荔湾区一幼儿园午休室突然起火 幸无人伤亡,0,http://news.163.com/17/0511/06/CK4S1VOP00018AOP.html
,熊孩子贪玩划花小区多辆轿车，家长得知后当场被气晕 ,255,http://www.toutiao.com/a6411116201850470657/#p=1,男子开奔驰拒缴10元过路费：家在附近不需要给,1,http://news.163.com/17/0511/08/CK544L6Q0001875P.html
,拾荒者睡桥洞三年自创彩票算法 称3小时可算出开奖号码,241,http://www.toutiao.com/a6418318267286290946/,"男子突然收到儿子""遗书"" 原为军队组织写信活动",18,http://news.163.com/17/0511/07/CK50AQQP0001899N.html
,警示！新的碰瓷手段，可能让你倾家荡产,35,http://www.toutiao.com/a6418316988476670210/,海口叫停萤火虫文化节 专家:盲目放生或影响生态,309,http://news.163.com/17/0511/01/CK4BEK9R000187VI.html
,非洲人有了手机却没办法充电，于是…… ,59,http://www.toutiao.com/a6416666816805961986/#p=1,女司机深夜开保时捷撞派出所大门：对处理结果不满,58,http://news.sohu.com/20170511/n492562574.shtml
,交警喜欢查什么样的车，你中招没？,11,http://www.toutiao.com/a6416640036137435393/,共享单车海淀智享遇冷：数量投入不足 骑行范围受限,0,http://www.chinanews.com/sh/2017/05-11/8220669.shtml
,山东一女子直播割腕 网警赶到时轻生女已昏迷,4,http://news.163.com/17/0510/11/CK2Q9NU30001875P.html,云南昆明：监狱逃犯逃亡9天后被抓获,,http://news.cctv.com/2017/05/10/ARTIv86gaF6aCUj1nBB3CJgn170510.shtml
,厨师潜伏后厨一年，列出地沟油的黑色菜单，外出点菜必须注意！,200,http://www.toutiao.com/a6418195244823150849/,杜鹃花怒放 漫山花海惹人醉,,http://news.cctv.com/2017/05/10/ARTI5SV3JrewDLbcTC68Ct3X170510.shtml
,网友曝北电学生遭班主任之父性侵 北电官博被刷爆,169,http://society.qq.com/a/20170510/023587.htm,重庆：货车拖浓烟过隧道 影响交通被查处,,http://news.cctv.com/2017/05/09/ARTIYd0OEQyLZ1WC6lNNYbQD170509.shtml
,长沙一名六旬保安写4页情书给女业主 直呼宝贝爱妻,161,http://bj.jjj.qq.com/a/20170509/038113.htm#p=1,武汉：女童跨市求医 警车开道全程护送,,http://news.cctv.com/2017/05/09/ARTIN1pT9t8mXPOqHWrFhss5170509.shtml
,2岁幼童3楼坠落 小学女生路过徒手追接,6,http://news.163.com/17/0510/13/CK3392400001875P.html,孕妇临盆司机违法驾车 民警温情当代驾,,http://news.cctv.com/2017/05/09/ARTIHwiaOsQpOSkKwuw8IMaC170509.shtml
,大学生菜场直播卖菜 每天卖出3000斤收入超白领,19,http://news.163.com/17/0510/13/CK32ACG80001875P.html,展现我国考古成果 近400件珍贵藏品18日将亮相首博,,http://news.cctv.com/2017/05/09/ARTIX9UaImJpddKMxwtj69a1170509.shtml
,"多名男子花数万彩礼""娶""妻 不足1月新娘集体失踪",931,http://news.163.com/17/0510/13/CK310D1A0001875P.html,iPhone流水线上的青春,365,http://news.sohu.com/20170504/n491758468.shtml
,"海口一动物园被指""动物炼狱"":爬虫馆半数蛇成蛇干",377,http://news.163.com/17/0510/13/CK310QMC000187VE.html,海口一海鲜坊因商业贿赂、虚假宣传被罚258万元,2,http://news.sohu.com/20170510/n492423824.shtml
,山东济宁一居民家中煤气爆炸 阳台一面墙被炸掉,0,http://news.163.com/17/0510/11/CK2R101000018AOP.html,10岁男孩被爷爷扔路边：只因有两张试卷没做完,149,http://news.sohu.com/20170504/n491748755.shtml
,车上装一个“流氓钩”，据说可以防追尾？,1,http://www.toutiao.com/a6418339196163490049/,南京一大楼突然塌方险些砸中面包车 暂无人员伤亡,1,http://news.sohu.com/20170504/n491741423.shtml
,一万年都用不到一楼的电梯，结果该交的电梯费一分也少不了！,329,http://www.toutiao.com/a6415826628019339522/,河北省副省长：确保河北奥体中心7月底建成启用,0,http://news.sohu.com/20170504/n491728915.shtml
,这五种情况可以多拿工资，你知道吗？,1,http://www.toutiao.com/a6418014350757347585/,茅台划定批发价零售价两红线：从讲政治高度看价,513,http://news.sohu.com/20170504/n491728724.shtml
,全球最年轻领导人:这位女元首29岁 比金正恩还小,25506,http://news.163.com/17/0509/16/CK0R7FE30001875O.html,北京商住楼盘现场：中介门店改成便利店,115,http://news.sohu.com/20170504/n491713151.shtml
,"""劝生人员""藏身""蓝鲸游戏""群 曾劝回多名欲自杀者",868,http://news.163.com/17/0510/14/CK34UFUH000187VE.html,铁路部门就围棋国手被降座致歉：列车员应做好解释,341,http://news.sohu.com/20170504/n491691908.shtml
,云南落网越狱逃犯曾在部队服役5年 系散打高手,13,http://news.163.com/17/0510/15/CK37IKVN00018AOR.html,排爆专家福建无人区引爆300公斤美式航弹,8,http://news.sohu.com/20170504/n491686205.shtml
,彪悍！女司机倒车撞塌房子 又一脚油门撞飞前车,572,http://news.163.com/17/0510/14/CK3640HQ0001875P.html,女法医工作13年不敢化妆喷香水：破坏现场气味,263,http://news.sohu.com/20170504/n491681470.shtml
,成都63岁大爷嫖娼未遂 被2名假警察敲诈1万元,797,http://news.163.com/17/0510/13/CK325PTV0001875P.html,国土资源部：新发现大中型及以上金矿70多处,116,http://news.sohu.com/20170503/n491595846.shtml
,乘客带手风琴上飞机 空乘要求其弹一首曲子才罢休,1329,http://news.163.com/17/0510/13/CK30RK020001875P.html,河南安阳殷墟发现18座匈奴墓葬 距今1800年,45,http://news.sohu.com/20170503/n491597212.shtml
,"重庆现""五星级""""土豪""公厕 每个耗资100万元",30760,http://news.163.com/photoview/00AP0001/2254457.html#p=CK2JJ31700AP0001,大兴安岭毕拉河森林火灾：系司炉工倒燃烧残渣引发,0,http://news.sohu.com/20170503/n491602104.shtml
,南郊某小区一女性堕楼身亡!韶关五日三起轻生事件,,http://m.gmw.cn/gallery/201705/10/24438346.html?tt_group_id=6418336020077773058,铁岭落马公安局长谷凤杰患重疾 暂予监外执行一年,0,http://news.sohu.com/20170503/n491595360.shtml
,中国“最具吸引力”10大城市，你的家乡上榜没？,,http://m.21so.com/2017/qqb21news_0509/55516_w.html?tt_group_id=6418097421960724738,国家外汇管理局副局长邓先宏逝世 享年60岁,0,http://news.sohu.com/20170503/n491595021.shtml
,男孩放学被陌生女债主拖走 保安隔着马路看穿险情,656,http://news.163.com/17/0510/15/CK38QRRS0001899N.html,国产大飞机C919计划5月5日首飞,1049,http://news.sohu.com/20170503/n491577887.shtml
,小伙子菜市场卖菜 四个平台直播全程,869,http://news.163.com/photoview/00AP0001/2254562.html#p=CK3CBJFM00AP0001,铁岭落马公安局长暂予监外执行 曾接替王立军任职,55,http://news.sohu.com/20170503/n491578355.shtml
,"尼加拉瓜牧师为女子""驱魔""致其活活烧死 获刑30年",39,http://news.163.com/17/0510/16/CK3C08DI0001875P.html,领导司机用工作之便索贿100万 被判5年罚款30万,0,http://news.sina.com.cn/c/2017-05-11/doc-ifyfecvz0879417.shtml
,六旬大爷独居深山，将自己打扮成女人，每次出门上街常遭人冷眼！,63,http://www.toutiao.com/a6418145542798573825/#p=1,男子冒充张学良曾孙签订劳动合同被判无效,58,http://news.sohu.com/20170503/n491545981.shtml
科技,日本遭遇50年来首次沙尘暴 日媒：从中国吹来的,3028,http://tech.163.com/17/0509/10/CK04M0K500097U81.html,魅族架构改革建三大事业部：黄章亲自挂帅为上市 ,2324,http://tech.163.com/17/0509/10/CK04OO4J00097U7S.html
,"Apple Pay啃不动中国市场 源于微信支付宝""太强""?",2098,http://tech.163.com/17/0509/07/CJVQ10P300097U7T.html,重温卡西尼号拍下的最壮观土星图片,684,http://tech.163.com/photoview/0AI20009/14931.html#p=CK00JL9J0AI20009
,百度6月1日起将全面实行实名制 用户必须绑定手机,1,http://tech.163.com/17/0509/14/CK0HFBSB00097U7R.html,袁隆平：海水稻技术可增1亿亩良田多养活8千万人,1858,http://tech.163.com/17/0509/11/CK095P5P00097U81.html
,谷歌神秘新系统有了图形界面：以后会取代安卓吗,2015,http://tech.163.com/17/0509/07/CJVS7O5800097U7T.html,中消协约谈易到:尽快解决打车难、退款难和沟通难,2,http://tech.163.com/17/0509/14/CK0H337500097U7R.html
,滴滴在北京推“豪华车”：价格比专车还贵了一倍,983,http://tech.163.com/17/0509/10/CK06BETH00097U7R.html,联通董事长王晓初:正与十部委沟通混改 难度不小,107,http://tech.163.com/17/0509/11/CK087D5800097U7S.html
,从财报看，京东是如何实现上市后首次单季盈利的,661,http://tech.163.com/17/0509/09/CK022I2R00097U7R.html,法拉第放出FF91新宣传片，可什么时候量产上市,362,http://tech.163.com/17/0509/12/CK0AHM0100097U7T.html
